{
  "status": "READY",
  "summary": "REQ-009: one additional ownership scenario across statuses, and two existing authorization test cases suggested for automation.",
  "proposedTestCases": [
    {
      "provisionalId": "PTC-009-01",
      "requirementId": "REQ-009",
      "scenario": "A request created by Sam stays absent from Alex's `GET /api/requests` after it is submitted and after it is approved (data-driven over SUBMITTED and APPROVED)",
      "level": "API",
      "type": "Authorization",
      "priority": "P1",
      "automationCandidate": true,
      "rationale": "TC-009-02 checks another Employee's request without naming a status; this scenario checks that ownership filtering does not depend on the status.",
      "acceptanceCriteria": ["The response contains no requests belonging to other Employees."],
      "relatedTestCases": ["TC-009-02"]
    }
  ],
  "automationCandidates": [
    {
      "testCaseId": "TC-009-06",
      "rationale": "P0 authorization rule (Reviewer gets 403), deterministic and cheap through the API; no committed test references it."
    },
    {
      "testCaseId": "TC-009-07",
      "rationale": "Unauthenticated access returns 401; deterministic, no data needed; no committed test references it."
    }
  ],
  "assumptions": [
    {
      "statement": "Preconditions for SUBMITTED and APPROVED are prepared through the API, as the test plan's test-data rules require.",
      "impact": "The scenario does not depend on UI flows."
    }
  ],
  "findings": [
    {
      "kind": "gap",
      "severity": "info",
      "message": "No REQ-009 test case is referenced by a committed test."
    }
  ],
  "contextRequests": []
}
